title,text,subject,date,label,text_length
"North Korea likely to pursue talks, South says in rosy New Year forecast","SEOUL (Reuters) - South Korea predicted on Tuesday that North Korea would look to open negotiations with the United States next year in an optimistic outlook for 2018, even as Seoul set up a specialized military team to confront nuclear threats from the North. The U.N. Security Council unanimously imposed new, tougher sanctions on reclusive North Korea on Friday for its recent intercontinental ballistic missile test, a move the North branded an economic blockade and act of war.  North Korea will seek negotiation with United States, while continuing to pursue its effort to be recognized as a de facto nuclear-possessing country,  South Korea s Unification Ministry said in a report, without offering any reasons for its conclusion. The Ministry of Defence said it would assign four units to operate under a new official overseeing North Korea policy, aimed to  deter and respond to North Korea s nuclear and missile threat . Tensions have risen over North Korea s nuclear and missile programs, which it pursues in defiance of years of U.N. Security Council resolutions, with bellicose rhetoric coming from both Pyongyang and the White House. U.S. diplomats have made clear they are seeking a diplomatic solution but President Donald Trump has derided talks as useless and said Pyongyang must commit to giving up its nuclear weapons before any talks can begin. In a statement carried by the official KCNA news agency, North Korea said the United States was terrified by its nuclear force and was getting  more and more frenzied in the moves to impose the harshest-ever sanctions and pressure on our country . China, the North s lone major ally, and Russia both supported the latest U.N. sanctions, which seek to limit the North s access to refined petroleum products and crude oil and its earnings from workers abroad, while on Monday Chinese Foreign Ministry spokeswoman Hua Chunying called for all countries to ease tension. On Tuesday, Beijing released customs data indicating China exported no oil products to North Korea in November, apparently going over and beyond U.N. sanctions.  China, the main source of North Korea s fuel, did not export any gasoline, jet fuel, diesel or fuel oil to its neighbor last month, data from the General Administration of Customs showed. China also imported no iron ore, coal or lead from North Korea in November. In its 2018 forecast, South Korea s Unification Ministry said it believed the North would eventually find ways to blunt the effects of the sanctions.  Countermeasures will be orchestrated to deal with the effects, including cuts in trade volume and foreign currency inflow, lack of supplies, and reduced production in each part of the economy,  the report said. The latest round of sanctions was prompted by the Nov. 29 test of what North Korea said was an intercontinental ballistic missile that put the U.S. mainland within range of its nuclear weapons. The Joongang Ilbo Daily newspaper, citing an unnamed South Korean government official, reported on Tuesday that North Korea could also be preparing to launch a satellite into space. Experts have said such launches are likely aimed at further developing the North s ballistic missile technology, and as such would be prohibited under U.N. resolutions.  The North Korean Rodong Sinmun newspaper said on Monday saying that  peaceful space development is a legitimate right of a sovereign state . North Korea regularly threatens to destroy South Korea, the United States and Japan, and says its weapons are necessary to counter U.S. aggression. The United States stations 28,500 troops in the South, a legacy of the 1950-53 Korean War, and regularly carries out military exercises with the South, which the North sees as preparations for invasion. ",worldnews,"December 26, 2017 ",1,3830
Canada data shows 10 percent of Haitian border crossers get refugee status,"TORONTO (Reuters) - Canada has granted refugee status to about 10 percent of the 298 Haitian border crossers whose applications have been processed this year, according to government data released on Wednesday.  That could bode ill for the 6,000 Haitians still in the refugee queue who illegally crossed the Canada-U.S. border by foot fearing that U.S. President Donald Trump would revoke their Temporary Protected Status.  And it may discourage more from illegally crossing into Canada after the U.S. government on Monday said it would end protected status for nearly 60,000 Haitians living in the United States in July 2019. Of the 298 Haitian applications processed so far this year, 68 were abandoned by the asylum seekers, which means they did not turn up for their hearings, the data released from the Immigration and Refugee Board showed. Another 62 withdrew their applications, according to the data from the quasi-judicial body whose tribunals determine refugee claims.  Montreal-based refugee lawyer Eric Taillefer said he thinks the Haitians who already made the border crossing did not understand Canadian laws on granting asylum.  They don t understand the evidence threshold, they don t understand, maybe, the definition of a refugee,  he said. The Canadian government has dispatched parliamentarians to talk to U.S. diaspora communities and dispel myths around Canada s immigration and refugee systems. Haiti-born politician Emmanuel Dubourg was in New York City this week. The high rates of abandoned claims could be because asylum seekers had trouble navigating the system and were not aware they needed to show up at a hearing, Taillefer said. Haitians are among some 17,000 asylum seekers who have walked across the border into Canada so far this year. Border crossers from other countries fared better, with 46 percent of Nigerian claims accepted, and 94 percent of Turkish people and 88 percent of Syrians approved. The stream of people crossing the border has eased since August, when there were hundreds each day, but Canadian authorities are planning for more people in the winter months.  The federal government is paying a Quebec company C$1.2 million to set up heated trailers to accommodate up to 200 people at a temporary encampment where asylum seekers have been staying while they await processing by the Canada Border Services Agency. ",worldnews,"November 23, 2017 ",1,2441
Trump Visits Hurricane Irma Survivors…One Survivor Has A Hysterical Question To Ask [Video],"You have to love this! A Florida man greeted President Trump today with a question that the president told him to ask the press:  Where was Obama on the last hurricane?  Then he answered his own question:  Obama Was Playing Golf During The Last Hurricane Remember that? Obama didn t want to interrupt his vacation to travel to see hurricane survivors Not one peep from Michelle either. What a difference a presidency makes!FLASHBACK TO MARTHA S VINEYARD:  Where was President Obama when the most serious natural disaster happened during his 8 years in office? He was golfing on Martha s Vineyard, and refused to leave his golfing vacation to assess the situation.President Obama is stirring resentment over his refusal to interrupt his Martha s Vineyard vacation to survey the Louisiana flood   the worst U.S. natural disaster since 2012   while drawing comparisons to President George W. Bush s hotly criticized response to Hurricane Katrina in the same state.Homeland Security Secretary Jeh Johnson defended Mr. Obama at a press conference Thursday, insisting that the president is  closely monitoring  the situation but that he will not cut short his two-week breather in the tony Massachusetts resort. The president can t be everywhere,  Mr. Johnson told reporters in Denham Springs, Louisiana.Louisiana Gov. John Bel Edwards, a Democrat, backed him up, saying at the press conference that he is  not complaining in any way about our federal partnership. Even so, Mr. Obama s lack of urgency is drawing unflattering parallels to the federal response in 2005, when Mr. Bush was branded as uncaring and even racist for not touching down during a flyover two days after Hurricane Katrina.   Washington Times",politics,"Sep 14, 2017",0,1799
JUST IN: TRUMP’S LONGTIME Bodyguard Tells Congress What REALLY Happened When Russians Offered To “Send 5 Women To Trump’s Room”,"After a business meeting before the Miss Universe Pageant in 2013, a Russian participant offered to  send five women  to Donald Trump s hotel room in Moscow, his longtime bodyguard told Congress this week, according to three sources who were present for the interview.Two of the sources said the bodyguard, Keith Schiller, viewed the offer as a joke, and immediately responded,  We don t do that type of stuff. The two sources said Schiller s comments came in the context of him adamantly disputing the allegations made in the Trump dossier, written by a former British intelligence operative, which describes Trump having an encounter with prostitutes at the hotel during the pageant. Schiller described his reaction to that story as being,  Oh my God, that s bull -,  two sources said.The conversation with the Russian about the five women took place after a morning meeting about the pageant in Moscow broke up, two sources said.That night, two sources said, Schiller said he discussed the conversation with Trump as Trump was walking back to his hotel room, and Schiller said the two men laughed about it as Trump went to bed alone. Schiller testified that he stood outside Trump s hotel room for a time and then went to bed.One source noted that Schiller testified he eventually left Trump s hotel room door and could not say for sure what happened during the remainder of the night.Two other sources said Schiller testified he was confident nothing happened.Schiller said he and Trump were aware of the risk that hotel rooms in Moscow could be set up to capture hidden video, two sources said.Schiller was grilled about the Moscow trip as part of four hours of testimony before the House Intelligence Committee. The questioning around the Moscow trip took a significant amount of time, the sources said. Schiller was also asked about the June 2016 meeting at Trump Tower between Donald Trump Jr. and Russians, two of the sources said. He testified that he did not recall much about that day. A White House lawyer familiar with the matter said that the White House  and fair-minded people are pleased that Mr. Schiller was able to debunk yet another of the false claims in the fantasy dossier funded by the DNC and the Clinton campaign and prepared during a time its foreign author worked closely with paid Russian operatives. A Navy veteran, Schiller worked part-time as a bodyguard for Trump while still an NYPD officer. He began working for Trump full-time after his retirement from the force in 2002 and became his director of security in 2004. He served as director of oval office operations in the Trump White House from January until September.  NBC News",left-news,"Nov 9, 2017",0,2793
Treasury nominee Mnuchin says long-term dollar strength important,"WASHINGTON (Reuters) - U.S. Treasury Secretary nominee Steven Mnuchin said on Thursday it was important to maintain a strong dollar in the long term, adding that President-elect Donald Trump’s recent comments that the currency was too strong were focused on short-term impacts. “When the president-elect made a comment on the U.S. currency, it wasn’t meant to be a long-term comment,” Mnuchin said in a confirmation hearing before the Senate Finance Committee. Mnuchin, a Wall Street veteran, added that Trump’s comments that the dollar was too strong were focused on short-term market factors that had pushed the greenback higher, hurting U.S. exports. “The long-term strength over long periods of time is important” for the dollar, Mnuchin said. ",politicsNews,"January 19, 2017 ",1,813
"Cubans sold everything to reach U.S., now hundreds stranded","PANAMA CITY (Reuters) - Hundreds of Cubans who sold their homes and belongings in pursuit of an American dream that now lays in tatters were stranded in Central America and Mexico on Friday after Washington abruptly ended a lenient immigration policy. U.S. President Barack Obama on Thursday repealed a measure granting automatic residency to virtually every Cuban who  arrived in the United States, whether or not they had visas, ending a longstanding exception to U.S. policy. The end of the “wet foot, dry foot” policy, which allowed any Cuban who reached U.S. soil to stay, but returned any picked up at sea, took effect immediately. Cuban officials had long sought the change, arguing it would discourage people-trafficking and dangerous journeys. Jose Enrique Manreza, who sold his house and possessions in Havana to embark on a epic trip by plane, bus and foot through the rain forests of French Guiana, Colombia and Panama, estimated he had spent about $10,000 on the journey.   “Imagine how I feel, after I spent six days and six nights running through rivers and jungles in the humidity,” said Manreza, at a migrant shelter in the southern Mexican city of Tapachula, where he heard the news, along with 30 other Cubans. In Honduras, 75 Cubans were waiting to move on to Mexico and the U.S. border. In Panama, another 75 gathered in the tree-shaded patio of the Caritas shelter in the capital. Many had sold everything they owned to pay for the voyage of a lifetime. Some said hundreds more were still traversing the treacherous forests of the Darien region bordering Colombia. Some expressed dismay that Obama, who is popular in Cuba for punching holes in the U.S. economic embargo and reinstating diplomatic relations, had taken a measure they saw as hurting ordinary Cubans. “Obama’s decision is killing our dreams,” said Yancys Riccart, 25, a teaching assistant, who said her journey took her through Guyana, Brazil, Ecuador and Colombia. She said she was worried she would be mistreated or not given work by Cuban authorities if she went back home. Victor Berrios, a deacon for Roman Catholic charity Caritas, urged the migrants not to rush into the hands of people-traffickers to reach the United States, reminding them that U.S. President-elect Donald Trump could reinstate the law when he assumes the presidency on Jan 20. “Be patient, we know that from the 20th there will be another government. Do not lose hope. Have faith,” Berrios said.  Washington has unveiled a flurry of last minute agreements to try to prevent Trump reversing the 2014 detente with Cuba, one of Obama’s flagship policies.  Trump has said he would scrap Obama’s Cuba policy unless the Cubans presented a better deal, but it was not immediately clear if he would try to bring back “wet-foot, dry-foot.” Anticipating the end of the policy, Cuban immigration has surged since the 2014 normalization. Ben Rhodes, Obama’s deputy national security adviser, said some 40,000 Cubans arrived in the United States in 2015 and about 54,000 in 2016. Thousands of Cubans gathered in Costa Rica and Panama last year as Central American countries struggled to cope with the influx. El Salvador welcomed the new policy, saying all immigrants should be treated equally.  Honduras, a source of thousands of immigrants to the United States each year, despite no Cuban-style special treatment, said it was waiting to see if the policy led to fewer Cubans traveling. Mexico’s foreign ministry had no immediate comment. Manreza said his wife, a nurse, was working in Venezuela as part of a Cuban oil-for-doctors program. Obama also rolled back a “medical parole” program dating back to 2006 that allowed Cuban doctors working in third countries to move to the United States simply by walking into a U.S. embassy. “She cried when I called her,” he said, without indicating whether she had intended to defect under the program.  Manreza, who ran a soda warehouse in Havana before he left in December with his daughter, said he was deciding whether to return to Cuba, broke, or seek asylum in Mexico.  Ivan Diaz, 45, a health administrator, said he had no intention of turning back. He left Cuba three months ago with his wife. He said the dash for the United States had cost about $25,000 for him, his wife and Miami family members who sent money to support them.  “I’ve got $10 left in my pocket,” said Diaz at the Tapachula center. “We are going to carry on. We don’t lose anything by going to the Laredo border. We must be able to do something. Otherwise, let them deport me back to Cuba.” ",politicsNews,"January 13, 2017 ",1,4620
BREAKING…Internal Memo From OBAMA’S Corrupt EPA: FLINT NOT WORTH “Going Out On A Limb For”,"Wow! Bernie and Hillary have been making hay over the Flint water crisis for months now, using the crisis to secure votes from the black community.  Leftists have been converging on the city like rats in search of the last peice of cheese on earth and now we have proof that Obama s EPA knew about the crisis, but didn t think the people of Flint were worthy of protecting.An internal Environmental Protection Agency memo showed officials didn t think  Flint is the community we want to go out on a limb for  while residents of the Michigan town drank lead-contaminated water.House Committee on Oversight and Government Reform Chairman Jason Chaffetz presented an internal memo between the EPA official who oversees Michigan, a branch manager in the EPA s Region 5, the associate director of the water division for Region 5 and an EPA environmental engineer about the water crisis in Flint.In the memo, one of the officials   it wasn t clear who based on the screen shown by Chaffetz   said Flint wasn t worth helping. Perhaps she already knows all this, but I m not so sure Flint is the community we want to go out on a limb for,  the memo stated.Chaffetz was incredulous at the memo. Are you kidding me?  he said, looking at Susan Hedman, the former director of EPA s Region 5, which oversees much of the Midwest including Michigan. Why isn t Flint the community they go to? Of all the communities, the community having trouble is the one you go all out for,  Chaffetz said.  Via: Washington Examiner",politics,"Mar 15, 2016",0,1592
How We’re Being Tricked: Fiddling With Temperature Data The Biggest Scam Ever,"Amen to this! Billions of your tax dollars have been redistributed in the name of global warming.  When future generations look back on the global-warming scare of the past 30 years, nothing will shock them more than the extent to which the official temperature records   on which the entire panic ultimately rested   were systematically  adjusted  to show the Earth as having warmed much more than the actual data justified. Two weeks ago, under the headline  How we are being tricked by flawed data on global warming , I wrote about Paul Homewood, who, on his Notalotofpeopleknowthat blog, had checked the published temperature graphs for three weather stations in Paraguay against the temperatures that had originally been recorded. In each instance, the actual trend of 60 years of data had been dramatically reversed, so that a cooling trend was changed to one that showed a marked warming. This was only the latest of many examples of a practice long recognised by expert observers around the world   one that raises an ever larger question mark over the entire official surface-temperature record.Watch: Climate change explained in 60 second animation:  Following my last article, Homewood checked a swathe of other South American weather stations around the original three. In each case he found the same suspicious one-way  adjustments . First these were made by the US government s Global Historical Climate Network (GHCN). They were then amplified by two of the main official surface records, the Goddard Institute for Space Studies (Giss) and the National Climate Data Center (NCDC), which use the warming trends to estimate temperatures across the vast regions of the Earth where no measurements are taken. Yet these are the very records on which scientists and politicians rely for their belief in  global warming .President Barack Obama will use the report as evidence for action as he tries to move ahead with policies on climate change before leaving office in 2017Homewood has now turned his attention to the weather stations across much of the Arctic, between Canada (51 degrees W) and the heart of Siberia (87 degrees E). Again, in nearly every case, the same one-way adjustments have been made, to show warming up to 1 degree C or more higher than was indicated by the data that was actually recorded. This has surprised no one more than Traust Jonsson, who was long in charge of climate research for the Iceland met office (and with whom Homewood has been in touch). Jonsson was amazed to see how the new version completely  disappears  Iceland s  sea ice years  around 1970, when a period of extreme cooling almost devastated his country s economy. One of the first examples of these  adjustments  was exposed in 2007 by the statistician Steve McIntyre, when he discovered a paper published in 1987 by James Hansen, the scientist (later turned fanatical climate activist) who for many years ran Giss. Hansen s original graph showed temperatures in the Arctic as having been much higher around 1940 than at any time since. But as Homewood reveals in his blog post,  Temperature adjustments transform Arctic history , Giss has turned this upside down. Arctic temperatures from that time have been lowered so much that that they are now dwarfed by those of the past 20 years.Read more: The Telegraph",Government News,"Nov 29, 2015",0,3396
BREAKING: Michigan Native KID ROCK Announces He’s Running For US Senate,"Kid Rock, aka Robert (Bob) Ritchie, a native of Michigan who was born and raised in my hometown of Romeo, just announced on Twitter that he s running for US Senate. As a kid, I remember frequently sitting across from the Ritchie family in our local Catholic church. Kid Rock is a philanthropist who s done so much to help those in need in the city of Detroit. He s also very passionate about supporting our troops. Ritchie s made several overseas trips to play for our troops, and even donated specially designed homes for disabled veterans. Ritchie (Kid Rock) has not yet announced which party he ll be aligning himself with. He s been a staunch supporter of Republican presidential candidates in the past like Mitt Romney, Ben Carson and after he won the GOP primary, Kid Rock got behind Donald Trump. In 2013, Ritchie told Rolling Stones that he considers himself more of a libertarian. Stay tuned I have had a ton of emails and texts asking me if this website is real  https://t.co/RRVgISDFeq The answer is an absolute YES. pic.twitter.com/uYCUg6mjW1  Kid Rock (@KidRock) July 12, 2017Rock is one of the most prominent right-leaning voices in music, but he s also a somewhat irregular Republican:  I don t like the hardcore views on either side and I m not in bed with anybody,  he told Rolling Stone in 2013.  I d probably be more libertarian, but I m a firm believer you have to pick a side. I can t be playing the middle. If Rock runs as a Republican, he ll be up against Trump s Michigan Campaign Chair, Lena Epstein for the GOP nomination.Lena is a candidate the left will have a very hard time defeating. She s Jewish, she s a Harvard grad, and she s a tough-minded, successful business woman who wasn t afraid to jump in and support Trump from the moment he announced he was running. Rock may have his hands full with the very popular Lena Epstein, who we believe has the ability to defeat the very liberal Democrat Senator Debbie Stabenow.  Rock has the star power, but many will question if he s really got what it takes to run for US Senate.CBS Sunday Morning attempts to find out who badass rocker Kid Rock really is in this interview:And for those who might be saying (or thinking) Kid Rock running for Senate is crazy or ridiculous. Keep in mind that Al Franken has been a Senator for 9 years:Democrats on Twitter right now: ""Kid Rock can't be a Senator   that's ridicolous!"" pic.twitter.com/WS1z8dlQxq  Ken Webster Jr (@ProducerKen) July 12, 2017Nancy Pelosi has been a Congresswoman for 30 years:And Maxine  Impeach Trump  Waters has held a political position since 1977 and has been serving in the US House of Representatives since 1991!",politics,"Jul 12, 2017",0,2728
