title,text,subject,date,label,text_length
" Trump’s UN Speech May Have Been Terrible, But The Faces Of Other Representatives Were Priceless","By now you would be more than aware of President Trump s first address to the United Nations General Assembly, a speech that CNN s senior White House correspondent Jim Acosta referred to as  a lot of Trump tweets strung together. Trump has never been shy in criticizing the UN, but now also needs their help and in his rambling, combative 41-minute speech, allegedly written by Stephen Miller, the President acted like school bully, calling terrorists  losers,  referring to Kim Jong Un as  Rocket Man  and threatening to  totally destroy North Korea if the US and its allies were forced to defend themselves.In fact, at times it almost seemed like an unfunny roast of sorts, looking around the room, randomly calling out world leaders and criticizing their leadership, as well as their countries; He called the Iranian government  a corrupt dictatorship behind the false guise of a democracy  whose  chief exports are violence, bloodshed, and chaos  and described Venezuela under President Nicol s Maduro as a  corrupt regime  that has  destroyed a prosperous nation by ideology that has produced poverty and misery everywhere it has been tried.  Strangely enough, Russia wasn t targeted in his act.President Trump seemed quite happy with his delivery, taking to Twitter to boast about the overwhelmingly positive reaction to his speech:A great and important day at the United Nations.Met with leaders of many nations who agree with much (or all) of what I stated in my speech!  Donald J. Trump (@realDonaldTrump) September 20, 2017But was it, though? Sure, Israeli Prime Minister Benjamin Netanyahu tweeted that, in his 30 years with the UN, he had never heard a  bolder or more courageous speech,  however, few shared Netanyahu s sentiments. They say a picture paints a thousand words and here are some pictures that show the true responses of those in attendance as the President delivered his address:Photo: Eduardo Munoz / ReutersNorth Korean ambassador Ja Song Nam stormed out before the President had even begun speaking, which left both seats empty for the Democratic People s Republic of Korea.Photos: Mary Altaffer/APAll White House Chief of Staff John Kelly could do was put his head in his hands and wish he was anywhere else, while the first lady listened on expressionless, although maybe she s just not capable of facial expressions right now.Photo: UNTVWere the Zimbabwean representatives even listening? I guess it could be a pretty opportune chance to catch a power-nap.Photo: UNTVThis Syrian delegate seemed to be giving President Trump a not-so-subtle hand gesture.Photo: Mary Altaffer / APThe first thing you would probably notice about this Iranian representative is his less-than-pleased facial expression, but it turns out it was the fact that he donned his glasses while Trump blasted Tehran s  rogue regime  that showed his true feelings:In Persian culture putting on one's glasses is the equivalent of GTFOH https://t.co/36u6Fx4anM  Arash Karami (@thekarami) September 19, 2017Photo: UNTVBut the facial expressions of everyone shown here were almost certainly representative of almost all in attendance.Featured image via Drew Angerer/Getty Images",News,"September 20, 2017",0,3271
 Donald Trump Owes HUNDREDS Of Ordinary People Money,"A new report reveals that Donald Trump swindled  hundreds  of people out of money. These aren t super rich investors (though he was involved in ventures that lost them money, too) but ordinary Americans who worked as  carpenters, dishwashers, painters, even his own lawyers.  They did work for Trump and he didn t pay them.USA Today uncovered Trump s big dodge while investigating the thousands of lawsuits he is involved in.Donald Trump often portrays himself as a savior of the working class who will  protect your job.  But a USA TODAY NETWORK analysis found he has been involved in more than 3,500 lawsuits over the past three decades   and a large number of those involve ordinary Americans, like the Friels, who say Trump or his companies have refused to pay them.At least 60 lawsuits, along with hundreds of liens, judgments, and other government filings reviewed by the USA TODAY NETWORK, document people who have accused Trump and his businesses of failing to pay them for their work. Among them: a dishwasher in Florida. A glass company in New Jersey. A carpet company. A plumber. Painters. Forty-eight waiters. Dozens of bartenders and other hourly workers at his resorts and clubs, coast to coast. Real estate brokers who sold his properties. And, ironically, several law firms that once represented him in these suits and others.Trump has portrayed himself   when not bashing immigrants, women and Muslims   as a friend of the working class, arguing that he will turn the Republican Party into a  worker s party. USA Today also found that Trump s companies have been cited at least 24 times since 2005 for violating the Fair Labor Standards Act  for failing to pay overtime or minimum wage. There also over 200 mechanic s liens that have been filed against Trump, his companies, or his properties, showing that he still owes money for work, some dating as far back in the 1980s.But his track record shows once again that Trump is a really rich guy (though probably not actually a billionaire) who didn t think twice of stepping on the little guy so he could get what he wants.In some cases, the Trump teams financially overpower and outlast much smaller opponents, draining their resources.You can t make America  great again  if you re hurting it now.Featured image via YouTube",News,"June 9, 2016",0,2343
Kuwait foreign ministry orders its nationals to leave Lebanon immediately: KUNA,"RIYADH (Reuters) - Kuwait s foreign ministry ordered its nationals to leave Lebanon immediately, according to a statement on Thursday carried by state news agency KUNA. The decision came hours after Saudi Arabia warned its citizens against traveling to Lebanon and asked those in the country to leave as soon as possible. ",worldnews,"November 9, 2017 ",1,401
HE WAS WARNED AGAINST NEGOTIATING WITH TERRORISTS: Iran Says They Won’t Permit Foreigners “to inspect the most normal military site in their dreams.”,"Iran, where the thought police will always have a job: Not only will we not grant foreigners the permission to inspect our military sites, we will not even give them permission to think about such a subject. A spokesman for Iran s nuclear agency has once again rejected calls to grant IAEA access to military sites, continuing a war of words on the issue that began Sunday.Press TV reports that Behrouz Kamalvandi, spokesman for the Atomic Energy Organization of Iran (AEOI), gave an interview Monday in which he stated that demands for access to Iran s military sites were  not practical and acceptable.  According to Press TV, his statement was a response to a claim U.S. Energy Secretary Ernest Moniz made earlier in the day.During an interview with Bloomberg News earlier Monday, Secretary Moniz said,  We expect to have anywhere, anytime access  within Iran. That statement appears to match the contents of the U.S. fact sheet published three weeks ago. The fact sheet states,  Iran will be required to grant access to the IAEA to investigate suspicious sites or allegations of a covert enrichment facility, conversion facility, centrifuge production facility, or yellowcake production facility anywhere in the country. Secretary Moniz s statement about access  anywhere, anytime  was itself an apparent response to a blunt statement Sunday by Brigadier General Hossein Salami. According to Press TV, General Salami gave an interview to Fars News in which he stated,  Not only will we not grant foreigners the permission to inspect our military sites, we will not even give them permission to think about such a subject.  In case that was not clear enough, Gen. Salami added,  They will not even be permitted to inspect the most normal military site in their dreams. General Salami is not the first high ranking Iranian to deny the IAEA will get access to Iran s military sites under the proposed deal. Nearly two weeks ago, Iran s Defense Minister said any inspection of Iran s military sites was  a red line  and added that no  inspection of any kind from such facilities would be accepted.  Ayatollah Khamenei backed up that stance the next day.AEOI spokesman Behrouz Kamalvandi who said military site inspections were not  acceptable was reportedly awaiting a nuclear delegation from Russia to discuss the construction of two new nuclear power plants in Iran next year.Via: Breitbart News",politics,"Apr 23, 2015",0,2546
WHY DID OBAMA APPROVE $418 Million Sale Of U.S. Weapons To Kenya On His Last Day In Office…And Why Was The Contract Awarded To A Firm Who Never Produced One Of These Planes?,"A group of lawmakers is planning to request a congressional investigation of a $418 million U.S. weapons sale to Kenya approved by the Obama administration on its last day in office. The sale, approved by the State Department and privately notified to Congress on January 19, would allow Kenya to buy 14 weaponized crop-duster-like planes   including two trainer planes and services, for missions against terrorist group al-Shabaab.The deal was publicly announced the Monday after Trump s inauguration.A handful of lawmakers, led by Rep. Ted Budd (R-NC), are questioning why the contract to produce the planes was awarded to major defense firm L3 Technologies   which has never produced such a plane   while a smaller, disabled veteran-owned company in North Carolina that already make those planes at a lower cost was not considered.The L3 contract would primarily benefit its Platform Integration Division in Waco, Texas. An L3 spokesman did not respond to a phone call asking for comment.Budd said the current deal is not a good one for the Kenyans either. He met with the Kenyan Deputy Chief of Mission last Monday, who was allegedly  flabbergasted  they were potentially paying almost $200 million more than necessary. We ve had several Kenyans reach out and thank us,  he said.Several Kenyan analysts also questioned the sale on Twitter, with the accompanying hashtag #KDFWeaponsScam. KDF is short for Kenyan Defense Force.We could have bought 5 of these Bell Boeing V-22 Ospreys at the $418 million expenditure #KDFWeaponsScam pic.twitter.com/2XXdS9g7VT  The Muthoka  (@MuthokaTito) February 17, 2017A US congressman has moved to halt Kenya's pending arms purchase saying that Kenya is getting a raw deal out of it. #KDFWeaponsScam  PATRIOT   (@PaulKiarie_) February 17, 2017This Twitter user questions the  thuggery  of the government that according to this user is currently over $3 trillion in debt.The kind of Thuggery being witnessed by Jubilee govt is the worst The public debt stands at over 3 trillion up from 1.6 #KDFWeaponsScam  Mafioso   (@elchapo_jnr) February 17, 2017The Mooresville, N.C. company, IOMAX USA Inc., costed out 14 planes at $237 million dollars, according to a Budd aide. It looks like politics,  Budd said in a phone interview with Breitbart News on Monday.  Why are they sending it to someone that s produced zero, for twice the price? This is inappropriate. Later this week, Budd and several other GOP congressmen are planning to request the non-partisan investigation.It is not just Republicans puzzled by the matter. Georgia Democrat Sanford Bishop will join Republicans in signing a letter being sent to the Kenyan ambassador to the U.S. on Tuesday.For entire story: Breitbart News",politics,"Feb 21, 2017",0,2895
Saudi's Kingdom Holding says has support from government after chairman detained,"DUBAI (Reuters) - Saudi Arabian investment firm Kingdom Holding 4280.SE said on Sunday it had the support of the country s government after billionaire chairman Prince Alwaleed bin Talal was detained overnight. Prince Alwaleed, one of the country s highest profile businessmen, was one of several princes, ministers, and former ministers detained as part of an anti-corruption crackdown, two senior Saudi officials told Reuters on Sunday. Kingdom Holding s chief executive, listed on its website as Talal Ibrahim al-Maiman, has received the support of the government, and would continue to operate  business as usual , the investment firm said in a stock market statement. Prince Alwaleed, a nephew of King Salman, and the grandson of Saudi Arabia s founder King Abdulaziz al-Saud, holds stakes in many major international companies including Citigroup, Twitter (TWTR.N), ride-hailing firm Lyft and Time Warner (TWX.N). Earlier, Kingdom Holding reported it swung to a third quarter profit after restating the same year ago period to a loss. ",worldnews,"November 5, 2017 ",1,1121
" Trump Just Bailed On His Own Pittsburgh Not Paris Rally, The Reason Why Is Infuriating","This week, Donald Trump disappointed the entire world by pulling out of the Paris climate deal. It was a decision that was condemned by several world leaders, and marked yet another way that Trump had ruined America s standing as a global leader. To celebrate his horrible decision, Trump organized a  Pittsburgh not Paris  rally to celebrate America s exit from the deal. There was just one major problem   Trump blew it off.The Trump campaign had hyped up this event so much, and even organized it to be located right across the street from the White House   put Donnie wasn t there. He bailed, and decided to play golf instead. So much for being a dedicated POTUS and showing his dwindling number of supporters that he appreciates them, as his approval ratings continue to plummet to historic lows.The White House Press Pool told PoliticusUSA: After an uneventful ride along highways and byways toward Sterling, Virginia, motorcade pulled up to the Trump National Golf Club at 10:42 a.m.Motorcade split off and pool is now holding in a spectacular clubhouse overlooking indoor tennis courts. If any of Trump s supporters still think Trump cared about and appreciated them, this is a pretty rude awakening. When Trump s campaign announced the rally, it certainly sounded like Trump would actually be present. However, the event invitation was a little more cryptic. It said: As you know, the President has been under siege from the mainstream media and the Democrats, especially now that he put American jobs first by withdrawing from the Paris Accord. Therefore, we are organizing a group to demonstrate our support for President Trump and his fearless leadership. Either way, these Trump supporters expected Trump to be there, and he wasn t because he was playing golf   his main hobby when he wants to avoid doing his job. Trump must know that his presidency is doomed, because blowing off a rally full of supporters when his popularity is suffering is a bold move. To make matters worse, this rally couldn t have been more convenient   it was just across the street! And yet, Trump couldn t be bothered.Featured image via Chip Somodevilla / Getty Images",News,"June 3, 2017",0,2246
Turkey's Erdogan says U.S. Jerusalem decision tramples on law,"ATHENS (Reuters) - Turkish President Tayyip Erdogan said on Thursday that U.S. President Donald Trump s  unfortunate  decision to recognize Jerusalem as the capital of Israel was  trampling on international laws . Erdogan speaking in Athens after talks with Prime Minister Alexis Tsipras, also said Turkey wanted to see a lasting solution on the island of Cyprus, but said Greek Cypriots were avoiding talks. ",worldnews,"December 7, 2017 ",1,470
WOW! HUNGARIAN PRIME MINISTER Cracks Down On Refugee Invasion…Calls Out Open-Borders Soros For Secretly Using “TONS OF MONEY AND HEAVY ARTILLERY” To Influence Politics,"Hungary s populist prime minister on Friday lashed out against billionaire financier George Soros, claiming he and groups backed by him want to secretly influence the country s politics.In his annual state of the nation speech, Viktor Orban said groups partly funded by Soros, who was born in Hungary, needed to be made transparent and identifiable. Large-bodied predators are swimming here in the waters. This is the trans-border empire of George Soros, with tons of money and international heavy artillery,  said Orban, who received a Soros-funded scholarship as Hungary was transitioning from communism to democracy in the late 1980s. It is causing trouble   that they are trying secretly and with foreign money to influence Hungarian politics,  Orban said.He did not cite evidence backing his claims, and did not identify the groups he mentioned. Government officials had earlier taken aim at corruption watchdog Transparency International and rights groups like the Hungarian Helsinki Committee and the Hungarian Civil Liberties Union.The Open Society Foundations is bigger than you think. In fact, it may be the largest philanthropic organization ever built, with branches in 37 countries. While the Gates Foundation spends more money, OSF has a larger footprint worldwide thanks to its many local offices, including throughout Africa. OSF s budget will be around $930 million this year which is substantially more than Ford s total grantmaking.That budget is set annually by George Soros, who s given away nearly $12 billion since he got into philanthropy decades ago. Nevertheless, thanks to his skills in financial markets, Soros who recently turned 85 is now richer than ever, with a net worth estimated at $26 billion. The bulk of that fortune is slated to go one day to OSF, creating a massively endowed foundation that, in recent years, has been redesigned to exist in perpetuity.Watch this video that explains a leaked memo from George Soros s Open Society Foundation, outlining a proposed strategy for successfully influencing immigration policy:In 2014, Orban ordered a crackdown on civic groups supported in part by Norway, but extensive investigations and audits did not uncover any financial irregularities of note.In an email to The Associated Press, a Soros representative said they were  proud to support Hungarians who insist on having a voice in their democracy. Orban also claimed that Soros  organizations were still working on bringing hundreds of thousands of migrants into Europe, contrary to the wishes of Hungarians and their government. Orban has been outspoken about his strong opposition to taking in refugees and migrants, and in 2015 ordered fences built on Hungary s southern borders with Serbia and Croatia to stop the migrant flow.On Friday, he reiterated a government plan to keep migrants in border camps built from shipping containers while their asylum applications are being processed.Orban also painted a bleak picture of Western Europe, saying its  future is casting a long and dark shadow on its present. He joked that Hungary was ready to take in Western Europeans, whom he said are suffering from globalization s effects. Naturally, we will take in the real refugees,  Orban said to laughter and loud applause.  The panicked German, Dutch, French and Italian politicians and journalists, Christians forced to leave their countries who want to find here the Europe they lost at home.  FOX News ",Government News,"Feb 14, 2017",0,3609
BREAKING EXCLUSIVE: BLACK REPUBLICAN Fired From Radio Station After Spending Time With Trump In Detroit,"For just a little over four months, Wayne Bradley could be heard spreading the conservative message on Detroit s 910AM Superstation. Then GOP nominee Donald Trump came to town, and things changed drastically.We ve known soft-spoken conservative, Wayne Bradley for several years. He s never been afraid of controversy and has always stood up for his conservative beliefs.On Friday, Bradley told us in an exclusive interview that local media had reached out to him when Trump came due to his position as State Director of African American Engagement for the Republican National Committee. Bradley   who was unpaid during his time at the station   didn t mention his affiliation with 910AM, which, he said, he generally doesn t do when discussing political issues with the media.He also met Trump and posted a photo of him with the candidate. When asked, Bradley said he had nothing to do with Trump s visit and was at at the rally with a pastor.The station, which was well aware of his work with the GOP, informed him by email that he was on  hiatus  that Friday, leading him to believe he would be back on the air shortly. But that wasn t the case.He received clarification on Monday that the show was canceled   for good.It s not clear why station management decided to cancel the show.A station representative told 100 Percent FED UP,  It was a business decision on the back-end. We contacted 910AM and spoke to an administrative assistant who refused to provide her name. According to the person we spoke to, no one at the station was available for comment because they were,  very, very  busy with meetings about Bradley s dismissal.The unnamed assistant told us that a statement would be released, but she was unsure when that might happen.But that s not what station owner Kevin Adell told the Detroit News. According to that report, Bradley was allegedly fired  for violating corporate policy. He violated corporate policy, that s why he got fired. He was let go for insubordination.  But it s not clear what policy Bradley allegedly violated. Bradley suggested it may have been due to the fact he didn t plug the station during interviews with the press.Regardless of the reason, Bradley said he appreciated the opportunity to have a dialogue with the community and was very grateful to have the air time.Moreover, he said that he understands the left-wing political climate in Detroit and respects the owner s decision.While he respects the decision, he told us he was  disappointed  with management for  silencing the dialogue. Others weren t happy with the decision and made their feelings known on the station s Facebook page. 910AM where blacks are kept on the Gov ment PLANTATION and other views of them PROSPERING on their own merits is not allowed,  one person said. Your way or the hiway-not the station I want to listen to-I m out!!!  another person added. I would like to know where Wayne Bradley is at? Why is he not on the air? Shameless,  commented a third critic.Bradley, who has been in radio off and on for about six years, says he s not worried and knows that something better will come along.And, he added, he appreciates the support of the listeners who reached out to the station.Meanwhile, the Oakland County Republican Party has offered their support for Wayne Bradley and asked fellow Republicans to call Superstation 910AM at:Station Phone: (248) 278-0910 Fax: (248) 350-3422 Studio Phone: (313) 209-9000Attention: Kevin Adell, Owner of 910 AM Dody Johnson, Station ManagerIn the meantime, Bradley said he ll continue his daily outreach efforts   something he s been doing since September 2013. It s a different battle in Detroit,  he told us. The key, he added, is to  stay positive. As for the incident with 910AM, Bradley said he views it as a  minor speed bump. ",politics,"Sep 16, 2016",0,3901
 Trump Throws Colossal Tantrum After America Finds Out About Secret Meeting With Putin (TWEETS),"Donald Trump has been exposed once again, and he s having a full blown meltdown because of it.Apparently, meeting with Russian leader Vladimir Putin for several hours during the G-20 summit wasn t enough, because it s just been discovered that Trump and Putin had another secret meeting, which the Trump administration did not disclose to the public.Once the media reported the secret meeting (which was later confirmed by the White House), Trump went into one of his Twitter tantrums and cried  fake news . Trump claimed that other world leaders had been invited and that the media had been well aware of the meeting.Trump apparently still doesn t understand that now that he s President of the United States, nothing in his life is private anymore. The president and his administration are expected to be transparent with the American people, and they ve truly incriminated themselves by failing to disclose this meeting. We can all assume that if this news hadn t come out, the Trump administration never would have disclosed it.Trump obviously doesn t think that having (and then hiding) a private meeting with the foreign leader who meddled in his country s election looks shady. It s hilarious that Trump referred to these reports as  fake news , only to have his own administration confirm that the meeting took place. Even Trump himself confirmed it in his tweets by talking about the other people that joined him and Putin!As Trump s meltdown over his Russia meeting continues, his focus and attention on negotiating a health care bill with Senate Republicans will be greatly compromised. This is a great example of why Trump hasn t been able to get anything done after several months of being in the White House. It also proves that the more Trump denies something, the more it s likely to be true!Featured image is a screenshot",News,"July 19, 2017",0,1933
